[
  {
    "state": "WV",
    "election_date": "2026-05-12",
    "election_type": "Primary",
    "office": "ASSESSOR - UNEXPIRED",
    "district": null,
    "county": "MARSHALL",
    "ocd_division_id": "ocd-division/country:us/state:wv/county:marshall",
    "candidate_name": "AMANDA LOCKHART",
    "party": "REPUBLICAN",
    "incumbent": null,
    "source_url": "https://candidates.wvsos.gov/candidate-web-api/candidates",
    "source_candidate_id": "957",
    "filing_date": "01/21/2026",
    "email": "AWINTERS1172@COMCAST.NET",
    "phone": null,
    "campaign_phone": "3042803984",
    "website": null,
    "occupation": null,
    "mailing_address_line": "1404 2ND ST",
    "mailing_city": "MOUNDSVILLE",
    "mailing_state": "WV",
    "mailing_zip": "26041",
    "residential_city": "MOUNDSVILLE",
    "residential_county": "MARSHALL",
    "source_office_id": "519",
    "source_office_type": "COUNTY",
    "local_jurisdiction": null,
    "first_name": "AMANDA",
    "middle_name": "L",
    "last_name": "LOCKHART",
    "suffix": null
  },
  {
    "state": "WV",
    "election_date": "2026-05-12",
    "election_type": "Primary",
    "office": "ASSESSOR - UNEXPIRED",
    "district": null,
    "county": "FAYETTE",
    "ocd_division_id": "ocd-division/country:us/state:wv/county:fayette",
    "candidate_name": "BABETTE HESS",
    "party": "REPUBLICAN",
    "incumbent": null,
    "source_url": "https://candidates.wvsos.gov/candidate-web-api/candidates",
    "source_candidate_id": "2073",
    "filing_date": "01/30/2026",
    "email": "BABETTE.HESS@YAHOO.COM",
    "phone": "3042377374",
    "campaign_phone": "3042377374",
    "website": null,
    "occupation": null,
    "mailing_address_line": "2119 WILLOW WOOD RD",
    "mailing_city": "OAK HILL",
    "mailing_state": "WV",
    "mailing_zip": "25901",
    "residential_city": "OAK HILL",
    "residential_county": "FAYETTE",
    "source_office_id": "519",
    "source_office_type": "COUNTY",
    "local_jurisdiction": null,
    "first_name": "BABETTE",
    "middle_name": "DAWN",
    "last_name": "HESS",
    "suffix": null
  },
  {
    "state": "WV",
    "election_date": "2026-05-12",
    "election_type": "Primary",
    "office": "ASSESSOR - UNEXPIRED",
    "district": null,
    "county": "FAYETTE",
    "ocd_division_id": "ocd-division/country:us/state:wv/county:fayette",
    "candidate_name": "TARA TYREE",
    "party": "REPUBLICAN",
    "incumbent": null,
    "source_url": "https://candidates.wvsos.gov/candidate-web-api/candidates",
    "source_candidate_id": "93",
    "filing_date": "01/12/2026",
    "email": null,
    "phone": null,
    "campaign_phone": null,
    "website": null,
    "occupation": null,
    "mailing_address_line": "PO BOX 342",
    "mailing_city": "SMITHERS",
    "mailing_state": "WV",
    "mailing_zip": "25186",
    "residential_city": "SMITHERS",
    "residential_county": "FAYETTE",
    "source_office_id": "519",
    "source_office_type": "COUNTY",
    "local_jurisdiction": null,
    "first_name": "TARA",
    "middle_name": "JO",
    "last_name": "TYREE",
    "suffix": null
  },
  {
    "state": "WV",
    "election_date": "2026-05-12",
    "election_type": "Primary",
    "office": "BOARD OF EDUCATION",
    "district": "23RD COUNTYWIDE",
    "county": "LOGAN",
    "ocd_division_id": "ocd-division/country:us/state:wv/county:logan",
    "candidate_name": "CRAIG MARCUM",
    "party": "NON-PARTISAN",
    "incumbent": null,
    "source_url": "https://candidates.wvsos.gov/candidate-web-api/candidates",
    "source_candidate_id": "1683",
    "filing_date": "01/29/2026",
    "email": null,
    "phone": null,
    "campaign_phone": null,
    "website": null,
    "occupation": null,
    "mailing_address_line": "P.O. BOX 377",
    "mailing_city": "VERDUNVILLE",
    "mailing_state": "WV",
    "mailing_zip": "25649",
    "residential_city": "VERDUNVILLE",
    "residential_county": "LOGAN",
    "source_office_id": "513",
    "source_office_type": "COUNTY",
    "local_jurisdiction": null,
    "first_name": "CRAIG",
    "middle_name": "ALLEN",
    "last_name": "MARCUM",
    "suffix": null
  },
  {
    "state": "WV",
    "election_date": "2026-05-12",
    "election_type": "Primary",
    "office": "BOARD OF EDUCATION",
    "district": "55TH COUNTYWIDE - 1ST DIVISION",
    "county": "WYOMING",
    "ocd_division_id": "ocd-division/country:us/state:wv/county:wyoming",
    "candidate_name": "DOUG KENNEDY",
    "party": "NON-PARTISAN",
    "incumbent": null,
    "source_url": "https://candidates.wvsos.gov/candidate-web-api/candidates",
    "source_candidate_id": "792",
    "filing_date": "01/12/2026",
    "email": null,
    "phone": null,
    "campaign_phone": null,
    "website": null,
    "occupation": null,
    "mailing_address_line": "PO BOX 343",
    "mailing_city": "MULLENS",
    "mailing_state": "WV",
    "mailing_zip": "25882",
    "residential_city": "MULLENS",
    "residential_county": "WYOMING",
    "source_office_id": "513",
    "source_office_type": "COUNTY",
    "local_jurisdiction": null,
    "first_name": "DOUGLAS",
    "middle_name": "RAY",
    "last_name": "KENNEDY",
    "suffix": null
  }
]
