[
  {
    "state": "CA",
    "election_date": "2026-11-03",
    "election_type": "General",
    "office": "Attorney General",
    "district": null,
    "county": null,
    "ocd_division_id": "ocd-division/country:us/state:ca",
    "candidate_name": "Michael E. Gates",
    "party": "Republican",
    "incumbent": null,
    "source_url": "https://elections.cdn.sos.ca.gov/statewide-elections/2026-general/cert-list-candidates.pdf",
    "source_candidate_id": null,
    "filing_date": null,
    "email": null,
    "phone": null,
    "campaign_phone": null,
    "website": null,
    "occupation": null,
    "mailing_address_line": null,
    "mailing_city": null,
    "mailing_state": null,
    "mailing_zip": null,
    "residential_city": null,
    "residential_county": null,
    "source_office_id": null,
    "source_office_type": null,
    "local_jurisdiction": null,
    "first_name": null,
    "middle_name": null,
    "last_name": null,
    "suffix": null
  },
  {
    "state": "CA",
    "election_date": "2026-11-03",
    "election_type": "General",
    "office": "Attorney General",
    "district": null,
    "county": null,
    "ocd_division_id": "ocd-division/country:us/state:ca",
    "candidate_name": "Rob Bonta",
    "party": "Democratic",
    "incumbent": true,
    "source_url": "https://elections.cdn.sos.ca.gov/statewide-elections/2026-general/cert-list-candidates.pdf",
    "source_candidate_id": null,
    "filing_date": null,
    "email": null,
    "phone": null,
    "campaign_phone": null,
    "website": null,
    "occupation": null,
    "mailing_address_line": null,
    "mailing_city": null,
    "mailing_state": null,
    "mailing_zip": null,
    "residential_city": null,
    "residential_county": null,
    "source_office_id": null,
    "source_office_type": null,
    "local_jurisdiction": null,
    "first_name": null,
    "middle_name": null,
    "last_name": null,
    "suffix": null
  },
  {
    "state": "CA",
    "election_date": "2026-11-03",
    "election_type": "General",
    "office": "Board of Equalization Member",
    "district": "1",
    "county": null,
    "ocd_division_id": "ocd-division/country:us/state:ca",
    "candidate_name": "Nelson Esparza",
    "party": "Democratic",
    "incumbent": null,
    "source_url": "https://elections.cdn.sos.ca.gov/statewide-elections/2026-general/cert-list-candidates.pdf",
    "source_candidate_id": null,
    "filing_date": null,
    "email": null,
    "phone": null,
    "campaign_phone": null,
    "website": null,
    "occupation": null,
    "mailing_address_line": null,
    "mailing_city": null,
    "mailing_state": null,
    "mailing_zip": null,
    "residential_city": null,
    "residential_county": null,
    "source_office_id": null,
    "source_office_type": null,
    "local_jurisdiction": null,
    "first_name": null,
    "middle_name": null,
    "last_name": null,
    "suffix": null
  },
  {
    "state": "CA",
    "election_date": "2026-11-03",
    "election_type": "General",
    "office": "Board of Equalization Member",
    "district": "1",
    "county": null,
    "ocd_division_id": "ocd-division/country:us/state:ca",
    "candidate_name": "Shannon Grove",
    "party": "Republican",
    "incumbent": null,
    "source_url": "https://elections.cdn.sos.ca.gov/statewide-elections/2026-general/cert-list-candidates.pdf",
    "source_candidate_id": null,
    "filing_date": null,
    "email": null,
    "phone": null,
    "campaign_phone": null,
    "website": null,
    "occupation": null,
    "mailing_address_line": null,
    "mailing_city": null,
    "mailing_state": null,
    "mailing_zip": null,
    "residential_city": null,
    "residential_county": null,
    "source_office_id": null,
    "source_office_type": null,
    "local_jurisdiction": null,
    "first_name": null,
    "middle_name": null,
    "last_name": null,
    "suffix": null
  },
  {
    "state": "CA",
    "election_date": "2026-11-03",
    "election_type": "General",
    "office": "Board of Equalization Member",
    "district": "2",
    "county": null,
    "ocd_division_id": "ocd-division/country:us/state:ca",
    "candidate_name": "John Pimentel",
    "party": "Democratic",
    "incumbent": null,
    "source_url": "https://elections.cdn.sos.ca.gov/statewide-elections/2026-general/cert-list-candidates.pdf",
    "source_candidate_id": null,
    "filing_date": null,
    "email": null,
    "phone": null,
    "campaign_phone": null,
    "website": null,
    "occupation": null,
    "mailing_address_line": null,
    "mailing_city": null,
    "mailing_state": null,
    "mailing_zip": null,
    "residential_city": null,
    "residential_county": null,
    "source_office_id": null,
    "source_office_type": null,
    "local_jurisdiction": null,
    "first_name": null,
    "middle_name": null,
    "last_name": null,
    "suffix": null
  }
]
