[
  {
    "state": "WA",
    "election_date": "2026-11-03",
    "election_type": "General",
    "office": "Assessor",
    "district": "County",
    "county": "Clallam",
    "ocd_division_id": "ocd-division/country:us/state:wa/county:clallam",
    "candidate_name": "Antonio Price",
    "party": null,
    "incumbent": null,
    "source_url": "https://voter.votewa.gov/elections/voterguide.ashx?e=899&la=en&c=&p=",
    "source_candidate_id": null,
    "filing_date": null,
    "email": null,
    "phone": null,
    "campaign_phone": null,
    "website": null,
    "occupation": null,
    "mailing_address_line": null,
    "mailing_city": null,
    "mailing_state": null,
    "mailing_zip": null,
    "residential_city": null,
    "residential_county": null,
    "source_office_id": "186544",
    "source_office_type": "CTY",
    "local_jurisdiction": "County",
    "first_name": null,
    "middle_name": null,
    "last_name": null,
    "suffix": null
  },
  {
    "state": "WA",
    "election_date": "2026-11-03",
    "election_type": "General",
    "office": "Assessor",
    "district": "County",
    "county": "Yakima",
    "ocd_division_id": "ocd-division/country:us/state:wa/county:yakima",
    "candidate_name": "Jacob Tate",
    "party": "Republican Party",
    "incumbent": null,
    "source_url": "https://voter.votewa.gov/elections/voterguide.ashx?e=899&la=en&c=&p=",
    "source_candidate_id": null,
    "filing_date": null,
    "email": null,
    "phone": null,
    "campaign_phone": null,
    "website": null,
    "occupation": null,
    "mailing_address_line": null,
    "mailing_city": null,
    "mailing_state": null,
    "mailing_zip": null,
    "residential_city": null,
    "residential_county": null,
    "source_office_id": "186935",
    "source_office_type": "CTY",
    "local_jurisdiction": "County",
    "first_name": null,
    "middle_name": null,
    "last_name": null,
    "suffix": null
  },
  {
    "state": "WA",
    "election_date": "2026-11-03",
    "election_type": "General",
    "office": "Assessor",
    "district": "County",
    "county": "San Juan",
    "ocd_division_id": "ocd-division/country:us/state:wa/county:san_juan",
    "candidate_name": "John Kulseth",
    "party": null,
    "incumbent": null,
    "source_url": "https://voter.votewa.gov/elections/voterguide.ashx?e=899&la=en&c=&p=",
    "source_candidate_id": null,
    "filing_date": null,
    "email": null,
    "phone": null,
    "campaign_phone": null,
    "website": null,
    "occupation": null,
    "mailing_address_line": null,
    "mailing_city": null,
    "mailing_state": null,
    "mailing_zip": null,
    "residential_city": null,
    "residential_county": null,
    "source_office_id": "186821",
    "source_office_type": "CTY",
    "local_jurisdiction": "County",
    "first_name": null,
    "middle_name": null,
    "last_name": null,
    "suffix": null
  },
  {
    "state": "WA",
    "election_date": "2026-11-03",
    "election_type": "General",
    "office": "Assessor",
    "district": "County",
    "county": "Yakima",
    "ocd_division_id": "ocd-division/country:us/state:wa/county:yakima",
    "candidate_name": "Keith Effler",
    "party": "Republican Party",
    "incumbent": null,
    "source_url": "https://voter.votewa.gov/elections/voterguide.ashx?e=899&la=en&c=&p=",
    "source_candidate_id": null,
    "filing_date": null,
    "email": null,
    "phone": null,
    "campaign_phone": null,
    "website": null,
    "occupation": null,
    "mailing_address_line": null,
    "mailing_city": null,
    "mailing_state": null,
    "mailing_zip": null,
    "residential_city": null,
    "residential_county": null,
    "source_office_id": "186935",
    "source_office_type": "CTY",
    "local_jurisdiction": "County",
    "first_name": null,
    "middle_name": null,
    "last_name": null,
    "suffix": null
  },
  {
    "state": "WA",
    "election_date": "2026-11-03",
    "election_type": "General",
    "office": "Assessor",
    "district": "County",
    "county": "Clallam",
    "ocd_division_id": "ocd-division/country:us/state:wa/county:clallam",
    "candidate_name": "Lee Hancock",
    "party": null,
    "incumbent": null,
    "source_url": "https://voter.votewa.gov/elections/voterguide.ashx?e=899&la=en&c=&p=",
    "source_candidate_id": null,
    "filing_date": null,
    "email": null,
    "phone": null,
    "campaign_phone": null,
    "website": null,
    "occupation": null,
    "mailing_address_line": null,
    "mailing_city": null,
    "mailing_state": null,
    "mailing_zip": null,
    "residential_city": null,
    "residential_county": null,
    "source_office_id": "186544",
    "source_office_type": "CTY",
    "local_jurisdiction": "County",
    "first_name": null,
    "middle_name": null,
    "last_name": null,
    "suffix": null
  }
]
